{
  "$schema": "https://json-schema.org/draft/2020-12/schema",
  "title": "CT Host Config",
  "type": "object",
  "additionalProperties": false,
  "properties": {
    "tsconfigPath": {
      "type": "string",
      "description": "Path to a tsconfig file used by ts-morph for type resolution (relative to repo root)."
    },
    "outputFile": {
      "type": "string",
      "description": "Generated registry output file path (relative to repo root)."
    },
    "ctStoriesRoot": {
      "type": "string",
      "description": "Root folder where *.component.ts files are considered story wrappers (relative to repo root)."
    },
    "searchRoots": {
      "type": "array",
      "items": { "type": "string" },
      "description": "Folders to scan for *.ct-story.ts and CT wrapper *.component.ts files (relative to repo root)."
    },
    "ignoredDirNames": {
      "type": "array",
      "items": { "type": "string" },
      "description": "Directory names to skip when walking searchRoots (e.g. node_modules, dist)."
    }
  }
}
