{
  "$schema": "./scripts/component-test-host/ct-host.config.schema.json",
  "tsconfigPath": "tsconfig.base.json",
  "outputFile": "apps/component-test-host/src/app/ct/ct-registry.generated.ts",
  "ctStoriesRoot": "apps/component-test-host/src/app/ct/stories",
  "searchRoots": ["apps/component-test-host/src/app/ct/stories", "libs"],
  "ignoredDirNames": [
    "node_modules",
    "dist",
    "tmp",
    ".nx",
    ".git",
    "playwright-report",
    "test-results"
  ]
}
